mysql> INSERT INTO school (name, country, capacity) VALUES ('Beauxbatons Academy of Magic','France',550);
Query OK, 1 row affected (0.00 sec)

mysql> INSERT INTO school (name, country, capacity) VALUES ('Castelobruxo','Brazil',380);
Query OK, 1 row affected (0.01 sec)

mysql> INSERT INTO school (name, country, capacity) VALUES ('Durmstrang Institute', Norway, 570);
ERROR 1054 (42S22): Unknown column 'Norway' in 'field list'
mysql> INSERT INTO school (name, country, capacity) VALUES ('Durmstrang Institute','Norway', 570);
Query OK, 1 row affected (0.00 sec)

mysql> INSERT INTO school (name, country, capacity) VALUES ('Hogwarts School of Witchcraft and Wizardry','United Kingdom',450);
Query OK, 1 row affected (0.00 sec)

mysql> INSERT INTO school (name, country, capacity) VALUES ('Ilvermorny School
of Witchcraft and Wizardry', 'USA', 300);
Query OK, 1 row affected (0.01 sec)

mysql> INSERT INTO school (name, country, capacity) VALUES ('Koldovstoretz','Russia',125);
Query OK, 1 row affected (0.00 sec)

mysql> INSERT INTO school (name, country, capacity) VALUES ('Mahoutokoro School of Magic','Japan',800);
Query OK, 1 row affected (0.00 sec)

mysql> INSERT INTO school (name, country, capacity) VALUES ('Uagadou School of Magic','Uganda',350);
Query OK, 1 row affected (0.00 sec)

mysql> Update school
    -> SET country
    -> = 'Sweden'
    -> WHERE id = 3;
Query OK, 0 rows affected (0.01 sec)
Rows matched: 0  Changed: 0  Warnings: 0

mysql> SELECT * FROM school;
+----+----------------------------------------------+----------+----------------+
| id | name                                         | capacity | country        |
+----+----------------------------------------------+----------+----------------+
|  1 | Hogwarts School of Witchcraft and Wizardry   |      450 | United Kingdom |
|  5 | Beauxbatons Academy of Magic                 |      550 | France         |
|  6 | Castelobruxo                                 |      380 | Brazil         |
|  7 | Durmstrang Institute                         |      570 | Norway         |
|  8 | Hogwarts School of Witchcraft and Wizardry   |      450 | United Kingdom |
|  9 | Ilvermorny School of Witchcraft and Wizardry |      300 | USA            |
| 10 | Koldovstoretz                                |      125 | Russia         |
| 11 | Mahoutokoro School of Magic                  |      800 | Japan          |
| 12 | Uagadou School of Magic                      |      350 | Uganda         |
+----+----------------------------------------------+----------+----------------+
9 rows in set (0.00 sec)

mysql> Update school SET country = 'Sweden' WHERE id = 7;
Query OK, 1 row affected (0.00 sec)
Rows matched: 1  Changed: 1  Warnings: 0

mysql> SELECT * FROM school;
+----+----------------------------------------------+----------+----------------+
| id | name                                         | capacity | country        |
+----+----------------------------------------------+----------+----------------+
|  1 | Hogwarts School of Witchcraft and Wizardry   |      450 | United Kingdom |
|  5 | Beauxbatons Academy of Magic                 |      550 | France         |
|  6 | Castelobruxo                                 |      380 | Brazil         |
|  7 | Durmstrang Institute                         |      570 | Sweden         |
|  8 | Hogwarts School of Witchcraft and Wizardry   |      450 | United Kingdom |
|  9 | Ilvermorny School of Witchcraft and Wizardry |      300 | USA            |
| 10 | Koldovstoretz                                |      125 | Russia         |
| 11 | Mahoutokoro School of Magic                  |      800 | Japan          |
| 12 | Uagadou School of Magic                      |      350 | Uganda         |
+----+----------------------------------------------+----------+----------------+
9 rows in set (0.00 sec)

mysql> Update school
    -> SET capacity = 700
    -> WHERE id = 11;
Query OK, 1 row affected (0.01 sec)
Rows matched: 1  Changed: 1  Warnings: 0

mysql> SELECT * FROM school;
+----+----------------------------------------------+----------+----------------+
| id | name                                         | capacity | country        |
+----+----------------------------------------------+----------+----------------+
|  1 | Hogwarts School of Witchcraft and Wizardry   |      450 | United Kingdom |
|  5 | Beauxbatons Academy of Magic                 |      550 | France         |
|  6 | Castelobruxo                                 |      380 | Brazil         |
|  7 | Durmstrang Institute                         |      570 | Sweden         |
|  8 | Hogwarts School of Witchcraft and Wizardry   |      450 | United Kingdom |
|  9 | Ilvermorny School of Witchcraft and Wizardry |      300 | USA            |
| 10 | Koldovstoretz                                |      125 | Russia         |
| 11 | Mahoutokoro School of Magic                  |      700 | Japan          |
| 12 | Uagadou School of Magic                      |      350 | Uganda         |
+----+----------------------------------------------+----------+----------------+
9 rows in set (0.00 sec)

mysql> DELETE FROM school WHERE name LIKE '%magic';
Query OK, 3 rows affected (0.00 sec)

mysql> SELECT * FROM school;
+----+----------------------------------------------+----------+----------------+
| id | name                                         | capacity | country        |
+----+----------------------------------------------+----------+----------------+
|  1 | Hogwarts School of Witchcraft and Wizardry   |      450 | United Kingdom |
|  6 | Castelobruxo                                 |      380 | Brazil         |
|  7 | Durmstrang Institute                         |      570 | Sweden         |
|  8 | Hogwarts School of Witchcraft and Wizardry   |      450 | United Kingdom |
|  9 | Ilvermorny School of Witchcraft and Wizardry |      300 | USA            |
| 10 | Koldovstoretz                                |      125 | Russia         |
+----+----------------------------------------------+----------+----------------+
6 rows in set (0.00 sec)

mysql> 
